<!ELEMENT isopackager (isofield+)>
        <!ELEMENT isofield EMPTY>
        <!ATTLIST isofield
                id CDATA #REQUIRED
                length CDATA #REQUIRED
                name CDATA #REQUIRED
                class CDATA #REQUIRED
                >
